{"$schema":"https://json-schema.org/draft/2020-12/schema","type":"object","additionalProperties":false,"required":["certificate_id","records","verdict","next_permitted_action"],"properties":{"certificate_id":{"const":"system-one-execution-readiness-1"},"records":{"type":"array","minItems":2,"maxItems":2,"items":{"type":"object","additionalProperties":false,"required":["packet_id","status","source_retrieval","integrity","structural_fit","partition_safety","baseline_viability","operational_rehearsal","failure"],"properties":{"packet_id":{"enum":["system-one-seed-candidate-packet-2","system-one-seed-candidate-packet-3"]},"status":{"const":"not-certified"},"source_retrieval":{"type":"string","minLength":30},"integrity":{"type":"string","minLength":30},"structural_fit":{"type":"string","minLength":30},"partition_safety":{"type":"string","minLength":30},"baseline_viability":{"type":"string","minLength":30},"operational_rehearsal":{"type":"string","minLength":30},"failure":{"type":"string","minLength":60}}}},"verdict":{"const":"no-selectable-primary-reserve-pair"},"next_permitted_action":{"type":"string","minLength":60}}}
