{"certificate_id":"system-one-execution-readiness-1","records":[{"packet_id":"system-one-seed-candidate-packet-3","status":"not-certified","source_retrieval":"Fresh Zenodo retrieval succeeded for data.zip and cv.r from record 571258.","integrity":"Local MD5 values match official data.zip and cv.r checksums.","structural_fit":"Timestamped reference-temperature and environmental-covariate columns are present at three sites.","partition_safety":"A chronological split is specified but no governed reader or frozen preregistration exists yet.","baseline_viability":"The published cv.r requires hash, hydroGOF, and foreach in addition to nnet; hash and hydroGOF are unavailable in the clean R 4.1 runtime.","operational_rehearsal":"An isolated project library installation attempt left only foreach available and did not make the published workflow executable.","failure":"The exact published baseline cannot run in the available clean runtime, and an independent base-R reconstruction with declared equivalence diagnostics has not been committed. This primary is not selectable."},{"packet_id":"system-one-seed-candidate-packet-2","status":"not-certified","source_retrieval":"Fresh Zenodo retrieval succeeded for the correlative code and declared CSV inputs from record 15739577.","integrity":"Locally retrieved code and data MD5 values match the official record.","structural_fit":"The data retain outcomes, predictors, host strain, and experimental-block identifiers needed for a held-block test.","partition_safety":"A leave-one-block-out split is specified but no governed reader or frozen preregistration exists yet.","baseline_viability":"The published correlative script requires lme4; lme4 is unavailable in the clean R 4.1 runtime and its modern dependency path requires unavailable Matrix-era components.","operational_rehearsal":"The isolated project library installation attempt did not install lme4 or a pinned compatible substitute.","failure":"The reserve baseline cannot be executed reproducibly in the current clean environment, and no independently specified equivalent model has been frozen. The reserve is not selectable."}],"verdict":"no-selectable-primary-reserve-pair","next_permitted_action":"Retain both readiness failures. Before reopening selection, create and validate an explicitly versioned, independently specified reconstruction for one candidate and identify a separately certified reserve; do not execute final outcomes or shift work to System 2."}
